{
  "request_id": "req_fix_cross_project_retrieval_001",
  "generated_at": "2026-04-10T11:30:00Z",
  "results": {
    "tactics": [
      "tac_metadata_prune_before_vector_rank_001"
    ],
    "invariants": [
      "inv_scope_filter_before_rank_001"
    ],
    "cases": [
      "case_retrieval_scope_drift_001"
    ],
    "evidence": [
      "ev_mem_20260410_001"
    ]
  },
  "explanations": [
    "Returned the current tactic first because the request asked how to prevent a live retrieval failure.",
    "Returned the invariant to explain why scope must be enforced before ranking.",
    "Returned the supporting case and evidence for auditability and re-distillation."
  ],
  "conflicts": []
}
